{"$schema":"https://json-schema.org/draft/2020-12/schema","$id":"gkd://schema/review/adapter-v1","additionalProperties":false,"properties":{"adapterDigest":{"pattern":"^[0-9a-f]{64}$","type":"string"},"adapterName":{"pattern":"^[A-Za-z0-9][A-Za-z0-9_.-]{0,63}$","type":"string"},"repositories":{"items":{"additionalProperties":false,"properties":{"capabilities":{"additionalProperties":false,"properties":{"artifacts":{"type":"boolean"},"checks":{"type":"boolean"},"diff":{"type":"boolean"},"pullRequest":{"type":"boolean"}},"required":["artifacts","checks","diff","pullRequest"],"type":"object"},"defaultBranch":{"type":"string"},"id":{"type":"string"},"identity":{"type":"string"},"policyPath":{"type":"string"},"provider":{"enum":["bitbucket","github","gitlab","unknown"]}},"required":["id","identity","provider","defaultBranch","policyPath","capabilities"],"type":"object"},"minItems":1,"type":"array"},"schemaVersion":{"const":1}},"required":["schemaVersion","adapterName","repositories","adapterDigest"],"type":"object"}
