{"adapterDigest":"24fc91d90f7fed709a6ea46d8173fcb77fe5e4279957a25144d17e40b846783b","adapterName":"example-multi-repository","repositories":[{"capabilities":{"artifacts":true,"checks":true,"diff":true,"pullRequest":true},"defaultBranch":"main","id":"alpha","identity":"example-org/alpha","policyPath":".gkd/policy.json","provider":"github"},{"capabilities":{"artifacts":false,"checks":true,"diff":true,"pullRequest":true},"defaultBranch":"trunk","id":"beta","identity":"example-org/beta","policyPath":".gkd/policy.json","provider":"gitlab"}],"schemaVersion":1}
